{
  "schema_version": 1,
  "stage": "authoring",
  "scope": "formula_discriminants_only_not_complete_proof_atom_mutation_suite",
  "witnesses": [
    {
      "id": "account_balance_discriminant",
      "evaluator_id": "account_balance",
      "stage": "authoring",
      "witness_domain": "independent_synthetic_minimal_case",
      "inputs": {
        "opening_balance_minor": 100,
        "eligible_amounts": [
          -20,
          30
        ],
        "after_cutoff_amount": 999
      },
      "expected": 110,
      "mutation": "include_after_cutoff",
      "mutated_result": 1109,
      "execution_status": "not_executed",
      "materialization_requirement": "Instantiate these functional quantities as schema-valid operands and prove unrelated atoms remain valid before execution; missing realization fails UNSATISFIED_MUTATION_WITNESS."
    },
    {
      "id": "balance_delta_discriminant",
      "evaluator_id": "balance_delta",
      "stage": "authoring",
      "witness_domain": "independent_synthetic_minimal_case",
      "inputs": {
        "amount_minor": -7
      },
      "expected": -7,
      "mutation": "absolute_value",
      "mutated_result": 7,
      "execution_status": "not_executed",
      "materialization_requirement": "Instantiate these functional quantities as schema-valid operands and prove unrelated atoms remain valid before execution; missing realization fails UNSATISFIED_MUTATION_WITNESS."
    },
    {
      "id": "bills_open_discriminant",
      "evaluator_id": "bills_open",
      "stage": "authoring",
      "witness_domain": "independent_synthetic_minimal_case",
      "inputs": {
        "open_due_amounts": [
          3,
          5
        ],
        "paid_amount": 100
      },
      "expected": 8,
      "mutation": "include_paid",
      "mutated_result": 108,
      "execution_status": "not_executed",
      "materialization_requirement": "Instantiate these functional quantities as schema-valid operands and prove unrelated atoms remain valid before execution; missing realization fails UNSATISFIED_MUTATION_WITNESS."
    },
    {
      "id": "budget_class_consumption_discriminant",
      "evaluator_id": "budget_class_consumption",
      "stage": "authoring",
      "witness_domain": "independent_synthetic_minimal_case",
      "inputs": {
        "flexible_consumption": [
          3,
          5
        ],
        "essential_consumption": [
          100
        ]
      },
      "expected": 8,
      "mutation": "ignore_class",
      "mutated_result": 108,
      "execution_status": "not_executed",
      "materialization_requirement": "Instantiate these functional quantities as schema-valid operands and prove unrelated atoms remain valid before execution; missing realization fails UNSATISFIED_MUTATION_WITNESS."
    },
    {
      "id": "calendar_event_count_discriminant",
      "evaluator_id": "calendar_event_count",
      "stage": "authoring",
      "witness_domain": "independent_synthetic_minimal_case",
      "inputs": {
        "eligible_ids": [
          "a",
          "b"
        ],
        "outside_period_id": "c"
      },
      "expected": 2,
      "mutation": "include_outside_period",
      "mutated_result": 3,
      "execution_status": "not_executed",
      "materialization_requirement": "Instantiate these functional quantities as schema-valid operands and prove unrelated atoms remain valid before execution; missing realization fails UNSATISFIED_MUTATION_WITNESS."
    },
    {
      "id": "category_budget_remaining_discriminant",
      "evaluator_id": "category_budget_remaining",
      "stage": "authoring",
      "witness_domain": "independent_synthetic_minimal_case",
      "inputs": {
        "limit_minor": 20,
        "eligible_consumption": [
          3,
          5
        ]
      },
      "expected": 12,
      "mutation": "add_instead_of_subtract",
      "mutated_result": 28,
      "execution_status": "not_executed",
      "materialization_requirement": "Instantiate these functional quantities as schema-valid operands and prove unrelated atoms remain valid before execution; missing realization fails UNSATISFIED_MUTATION_WITNESS."
    },
    {
      "id": "category_consumption_discriminant",
      "evaluator_id": "category_consumption",
      "stage": "authoring",
      "witness_domain": "independent_synthetic_minimal_case",
      "inputs": {
        "category_consumption": [
          9,
          -4
        ],
        "other_category_consumption": 100
      },
      "expected": 5,
      "mutation": "ignore_compensation",
      "mutated_result": 9,
      "execution_status": "not_executed",
      "materialization_requirement": "Instantiate these functional quantities as schema-valid operands and prove unrelated atoms remain valid before execution; missing realization fails UNSATISFIED_MUTATION_WITNESS."
    },
    {
      "id": "category_spent_discriminant",
      "evaluator_id": "category_spent",
      "stage": "authoring",
      "witness_domain": "independent_synthetic_minimal_case",
      "inputs": {
        "category_consumption": [
          9,
          -4
        ],
        "other_category_consumption": 100
      },
      "expected": 5,
      "mutation": "ignore_category",
      "mutated_result": 105,
      "execution_status": "not_executed",
      "materialization_requirement": "Instantiate these functional quantities as schema-valid operands and prove unrelated atoms remain valid before execution; missing realization fails UNSATISFIED_MUTATION_WITNESS."
    },
    {
      "id": "consumption_by_instrument_discriminant",
      "evaluator_id": "consumption_by_instrument",
      "stage": "authoring",
      "witness_domain": "independent_synthetic_minimal_case",
      "inputs": {
        "instrument_consumption": [
          3,
          5
        ],
        "other_instrument_consumption": 100
      },
      "expected": 8,
      "mutation": "include_other_instrument",
      "mutated_result": 108,
      "execution_status": "not_executed",
      "materialization_requirement": "Instantiate these functional quantities as schema-valid operands and prove unrelated atoms remain valid before execution; missing realization fails UNSATISFIED_MUTATION_WITNESS."
    },
    {
      "id": "consumption_difference_discriminant",
      "evaluator_id": "consumption_difference",
      "stage": "authoring",
      "witness_domain": "independent_synthetic_minimal_case",
      "inputs": {
        "left": 3,
        "right": 5
      },
      "expected": -2,
      "mutation": "absolute_difference",
      "mutated_result": 2,
      "execution_status": "not_executed",
      "materialization_requirement": "Instantiate these functional quantities as schema-valid operands and prove unrelated atoms remain valid before execution; missing realization fails UNSATISFIED_MUTATION_WITNESS."
    },
    {
      "id": "consumption_effect_discriminant",
      "evaluator_id": "consumption_effect",
      "stage": "authoring",
      "witness_domain": "independent_synthetic_minimal_case",
      "inputs": {
        "neutral_transfer_amounts": [
          -7,
          7
        ],
        "category": "neutral"
      },
      "expected": 0,
      "mutation": "sum_absolute_movement",
      "mutated_result": 14,
      "execution_status": "not_executed",
      "materialization_requirement": "Instantiate these functional quantities as schema-valid operands and prove unrelated atoms remain valid before execution; missing realization fails UNSATISFIED_MUTATION_WITNESS."
    },
    {
      "id": "consumption_total_discriminant",
      "evaluator_id": "consumption_total",
      "stage": "authoring",
      "witness_domain": "independent_synthetic_minimal_case",
      "inputs": {
        "expense": 9,
        "linked_refund": -4,
        "neutral": 0
      },
      "expected": 5,
      "mutation": "drop_linked_refund",
      "mutated_result": 9,
      "execution_status": "not_executed",
      "materialization_requirement": "Instantiate these functional quantities as schema-valid operands and prove unrelated atoms remain valid before execution; missing realization fails UNSATISFIED_MUTATION_WITNESS."
    },
    {
      "id": "due_bill_ids_discriminant",
      "evaluator_id": "due_bill_ids",
      "stage": "authoring",
      "witness_domain": "independent_synthetic_minimal_case",
      "inputs": {
        "eligible_ids": [
          "bill_a"
        ],
        "outside_due_id": "bill_b"
      },
      "expected": [
        "bill_a"
      ],
      "mutation": "include_outside_due",
      "mutated_result": [
        "bill_a",
        "bill_b"
      ],
      "execution_status": "not_executed",
      "materialization_requirement": "Instantiate these functional quantities as schema-valid operands and prove unrelated atoms remain valid before execution; missing realization fails UNSATISFIED_MUTATION_WITNESS."
    },
    {
      "id": "due_bills_total_discriminant",
      "evaluator_id": "due_bills_total",
      "stage": "authoring",
      "witness_domain": "independent_synthetic_minimal_case",
      "inputs": {
        "eligible_amounts": [
          3,
          5
        ],
        "outside_due_amount": 100
      },
      "expected": 8,
      "mutation": "include_outside_due",
      "mutated_result": 108,
      "execution_status": "not_executed",
      "materialization_requirement": "Instantiate these functional quantities as schema-valid operands and prove unrelated atoms remain valid before execution; missing realization fails UNSATISFIED_MUTATION_WITNESS."
    },
    {
      "id": "eligible_event_count_discriminant",
      "evaluator_id": "eligible_event_count",
      "stage": "authoring",
      "witness_domain": "independent_synthetic_minimal_case",
      "inputs": {
        "source_event_count": 0,
        "eligible_events": [
          "event_a"
        ]
      },
      "expected_violation": "coverage",
      "mutation": "trust_source_count_without_population_proof",
      "execution_status": "not_executed",